{
    "version": "0.3.0",
    "name": "Palp Defenders",
    "faction": "imperial",
    "points": 100,
    "pilots": [
        {
            "name": "colonelvessery",
            "ship": "tiedefender",
            "points": 35,
            "upgrades": {
                "ept": [
                    "juke"
                ],
                "title": [
                    "tiex7"
                ]
            }
        },
        {
            "name": "countessryad",
            "ship": "tiedefender",
            "points": 36,
            "upgrades": {
                "ept": [
                    "pushthelimit"
                ],
                "title": [
                    "tiex7"
                ],
                "mod": [
                    "twinionenginemkii"
                ]
            }
        },
        {
            "name": "omicrongrouppilot",
            "ship": "lambdaclassshuttle",
            "points": 29,
            "upgrades": {
                "system": [
                    "collisiondetector"
                ],
                "crew": [
                    "emperorpalpatine"
                ]
            }
        }
    ],
    "vendor": {
        "voidstate": {
            "squadron_id": 597998,
            "link": "http://xwing-builder.co.uk/view/597998/palp-defenders",
            "builder": "Voidstate's Unofficial X-Wing Squadron Builder",
            "builder_link": "http://xwing-builder.co.uk/build"
        }
    }
}