{
    "version": "0.3.0",
    "name": "Goon Squad",
    "faction": "scum",
    "points": 100,
    "pilots": [
        {
            "name": "manaroo",
            "ship": "jumpmaster5000",
            "points": 35,
            "upgrades": {
                "ept": [
                    "attannimindlink"
                ],
                "crew": [
                    "gonk"
                ],
                "samd": [
                    "r5p8"
                ],
                "illicit": [
                    "feedbackarray"
                ]
            }
        },
        {
            "name": "fennrau",
            "ship": "protectoratestarfighter",
            "points": 32,
            "upgrades": {
                "ept": [
                    "attannimindlink"
                ],
                "title": [
                    "concorddawnprotector"
                ],
                "mod": [
                    "autothrusters"
                ]
            }
        },
        {
            "name": "palobgodalhi",
            "ship": "hwk290",
            "points": 33,
            "upgrades": {
                "ept": [
                    "attannimindlink"
                ],
                "turret": [
                    "twinlaserturret"
                ],
                "crew": [
                    "dengar"
                ],
                "title": [
                    "moldycrow"
                ]
            }
        }
    ],
    "vendor": {
        "voidstate": {
            "squadron_id": 597997,
            "link": "http://xwing-builder.co.uk/view/597997/goon-squad",
            "builder": "Voidstate's Unofficial X-Wing Squadron Builder",
            "builder_link": "http://xwing-builder.co.uk/build"
        }
    }
}